file,字数,種別,new_desc
souba/jirei/card-1780970382709/index.html,143,定型/replace,"神奈川県の火災警報器増設・移設工事 ¥220,000 は適正かを建設実務30年のプロがsouba-dbの実測データで解説します。梅(最安)・竹(標準)・松(大手)の3プランで、あなたの見積もりが適正か比較できます。訪問販売の即決を断る方法や、相見積もりの取り方まであわせて確認できます。"
souba/jirei/card-1780972098413/index.html,147,定型/replace,"名古屋市のクロス貼り・電気工事一式 ¥1,760,000 は適正かを建設実務30年のプロがsouba-dbの実測データで解説します。訪問販売の即決を断る方法や、相見積もりの取り方まであわせて確認できます。見積書のチェックポイント、過剰請求の見分け方、業者に確認すべき点まで具体的にまとめました。"
souba/jirei/card-1780973514985/index.html,148,定型/replace,"鎌倉市の足湯下地コンクリート工事 ¥929,500 は適正かを建設実務30年のプロがsouba-dbの実測データで解説します。見積書のチェックポイント、過剰請求の見分け方、業者に確認すべき点まで具体的にまとめました。相場より高い見積もりの特徴と、値引き交渉で使える根拠を実例つきで解説しています。"
souba/jirei/card-1780973686308/index.html,149,定型/replace,"大阪府の天井カセット型エアコン新設工事 ¥668,360 は適正かを建設実務30年のプロがsouba-dbの実測データで解説します。相場より高い見積もりの特徴と、値引き交渉で使える根拠を実例つきで解説しています。梅(最安)・竹(標準)・松(大手)の3プランで、あなたの見積もりが適正か比較できます。"
souba/jirei/card-1780975729996/index.html,143,定型/replace,"神奈川県のシャワーユニット設置工事 ¥237,670 は適正かを建設実務30年のプロがsouba-dbの実測データで解説します。梅(最安)・竹(標準)・松(大手)の3プランで、あなたの見積もりが適正か比較できます。訪問販売の即決を断る方法や、相見積もりの取り方まであわせて確認できます。"
souba/jirei/card-1781104518318/index.html,153,定型/replace,"神奈川県の床・外構・サッシ・塗装複合リフォーム ¥1,391,775 は適正かを建設実務30年のプロがsouba-dbの実測データで解説します。訪問販売の即決を断る方法や、相見積もりの取り方まであわせて確認できます。見積書のチェックポイント、過剰請求の見分け方、業者に確認すべき点まで具体的にまとめました。"
souba/jirei/card-1781602070785/index.html,148,定型/replace,"のルームクリーニング・片付け工事 ¥108,460 は適正かを建設実務30年のプロがsouba-dbの実測データで解説します。見積書のチェックポイント、過剰請求の見分け方、業者に確認すべき点まで具体的にまとめました。相場より高い見積もりの特徴と、値引き交渉で使える根拠を実例つきで解説しています。"
souba/jirei/card-1781602137002/index.html,136,定型/replace,港区の床・防音工事の内訳不明確 は適正かを建設実務30年のプロがsouba-dbの実測データで解説します。相場より高い見積もりの特徴と、値引き交渉で使える根拠を実例つきで解説しています。梅(最安)・竹(標準)・松(大手)の3プランで、あなたの見積もりが適正か比較できます。
souba/jirei/card-1781615619155/index.html,146,定型/replace,"奈良県の4階建て住宅の包括的改装工事 ¥8,499,853 は適正かを建設実務30年のプロがsouba-dbの実測データで解説します。梅(最安)・竹(標準)・松(大手)の3プランで、あなたの見積もりが適正か比較できます。訪問販売の即決を断る方法や、相見積もりの取り方まであわせて確認できます。"
souba/jirei/card-1781615659191/index.html,146,定型/replace,"大阪の店舗新装工事（建築・設備） ¥1,000,000 は適正かを建設実務30年のプロがsouba-dbの実測データで解説します。訪問販売の即決を断る方法や、相見積もりの取り方まであわせて確認できます。見積書のチェックポイント、過剰請求の見分け方、業者に確認すべき点まで具体的にまとめました。"
souba/jirei/card-1781615707400/index.html,158,定型/replace,"大阪府の店舗改修工事(ウッドデッキ・照明・看板) ¥3,150,000 は適正かを建設実務30年のプロがsouba-dbの実測データで解説します。見積書のチェックポイント、過剰請求の見分け方、業者に確認すべき点まで具体的にまとめました。相場より高い見積もりの特徴と、値引き交渉で使える根拠を実例つきで解説しています。"
souba/jirei/card-1781615735578/index.html,144,定型/replace,"京都の事務所改装工事一式 ¥1,100,000 は適正かを建設実務30年のプロがsouba-dbの実測データで解説します。相場より高い見積もりの特徴と、値引き交渉で使える根拠を実例つきで解説しています。梅(最安)・竹(標準)・松(大手)の3プランで、あなたの見積もりが適正か比較できます。"
souba/jirei/card-1781616092585/index.html,145,定型/replace,"栃木県の住宅複数箇所内装リフォーム ¥4,818,930 は適正かを建設実務30年のプロがsouba-dbの実測データで解説します。梅(最安)・竹(標準)・松(大手)の3プランで、あなたの見積もりが適正か比較できます。訪問販売の即決を断る方法や、相見積もりの取り方まであわせて確認できます。"
souba/jirei/card-1781622703161/index.html,154,定型/replace,"神奈川県のテナント店舗新設工事（ダンススタジオ） ¥2,015,200 は適正かを建設実務30年のプロがsouba-dbの実測データで解説します。訪問販売の即決を断る方法や、相見積もりの取り方まであわせて確認できます。見積書のチェックポイント、過剰請求の見分け方、業者に確認すべき点まで具体的にまとめました。"
souba/jirei/card-1781622713913/index.html,149,定型/replace,"東京都のダンススクール新設工事 ¥4,081,000 は適正かを建設実務30年のプロがsouba-dbの実測データで解説します。見積書のチェックポイント、過剰請求の見分け方、業者に確認すべき点まで具体的にまとめました。相場より高い見積もりの特徴と、値引き交渉で使える根拠を実例つきで解説しています。"
souba/jirei/card-1781622964559/index.html,145,定型/replace,"神奈川県の店舗空調設備一式工事 ¥702,350 は適正かを建設実務30年のプロがsouba-dbの実測データで解説します。相場より高い見積もりの特徴と、値引き交渉で使える根拠を実例つきで解説しています。梅(最安)・竹(標準)・松(大手)の3プランで、あなたの見積もりが適正か比較できます。"
souba/jirei/card-1781622980866/index.html,143,定型/replace,"東京都のマンション内装改装工事 ¥6,355,800 は適正かを建設実務30年のプロがsouba-dbの実測データで解説します。梅(最安)・竹(標準)・松(大手)の3プランで、あなたの見積もりが適正か比較できます。訪問販売の即決を断る方法や、相見積もりの取り方まであわせて確認できます。"
souba/jirei/card-1781653795885/index.html,145,定型/replace,"神奈川県の住宅増築・改修工事 ¥15,840,000 は適正かを建設実務30年のプロがsouba-dbの実測データで解説します。訪問販売の即決を断る方法や、相見積もりの取り方まであわせて確認できます。見積書のチェックポイント、過剰請求の見分け方、業者に確認すべき点まで具体的にまとめました。"
souba/jirei/card-1781968245720/index.html,148,定型/replace,"大阪府の複数箇所内装改修工事 ¥1,554,960 は適正かを建設実務30年のプロがsouba-dbの実測データで解説します。見積書のチェックポイント、過剰請求の見分け方、業者に確認すべき点まで具体的にまとめました。相場より高い見積もりの特徴と、値引き交渉で使える根拠を実例つきで解説しています。"
souba/jirei/card-1782107951707/index.html,152,定型/replace,"神奈川県の和室フローリング化・浴室換気扇新設 ¥459,314 は適正かを建設実務30年のプロがsouba-dbの実測データで解説します。相場より高い見積もりの特徴と、値引き交渉で使える根拠を実例つきで解説しています。梅(最安)・竹(標準)・松(大手)の3プランで、あなたの見積もりが適正か比較できます。"
souba/jirei/card-1782184250119/index.html,150,定型/replace,"神奈川県の水廻り総リフォーム・離れ増築工事 ¥67,535,745 は適正かを建設実務30年のプロがsouba-dbの実測データで解説します。梅(最安)・竹(標準)・松(大手)の3プランで、あなたの見積もりが適正か比較できます。訪問販売の即決を断る方法や、相見積もりの取り方まであわせて確認できます。"
souba/jirei/index.html,138,定型/replace,リフォーム見積もり KIRA診断事例 24件一覧を建設実務30年のプロがsouba-dbの実測データで解説します。訪問販売の即決を断る方法や、相見積もりの取り方まであわせて確認できます。見積書のチェックポイント、過剰請求の見分け方、業者に確認すべき点まで具体的にまとめました。
souba/jishin-ato/index.html,143,相場入り/replace,地震後の点検詐欺を建設実務30年のプロがsouba-dbの実測データで解説します。適正相場の目安は10万〜50万円。見積書のチェックポイント、過剰請求の見分け方、業者に確認すべき点まで具体的にまとめました。相場より高い見積もりの特徴と、値引き交渉で使える根拠を実例つきで解説しています。
souba/kabe-hibi/index.html,144,相場入り/replace,外壁ひび割れ補修費用の相場を建設実務30年のプロがsouba-dbの実測データで解説します。適正相場の目安は1万〜3万円。相場より高い見積もりの特徴と、値引き交渉で使える根拠を実例つきで解説しています。梅(最安)・竹(標準)・松(大手)の3プランで、あなたの見積もりが適正か比較できます。
souba/kaden-hoken-zero-en-sagida/index.html,135,定型/replace,「火災保険で工事費が0円になる」は本当ですか？を建設実務30年のプロがsouba-dbの実測データで解説します。梅(最安)・竹(標準)・松(大手)の3プランで、あなたの見積もりが適正か比較できます。訪問販売の即決を断る方法や、相見積もりの取り方まであわせて確認できます。
souba/kaisou-ikko-takai/index.html,158,相場入り/replace,解体工事の見積もりが高すぎます。相場はいくらですか？を建設実務30年のプロがsouba-dbの実測データで解説します。適正相場の目安は90万〜150万円。訪問販売の即決を断る方法や、相見積もりの取り方まであわせて確認できます。見積書のチェックポイント、過剰請求の見分け方、業者に確認すべき点まで具体的にまとめました。
souba/kaitai-tsuika/index.html,149,相場入り/replace,解体工事の追加費用「全パターン」を建設実務30年のプロがsouba-dbの実測データで解説します。適正相場の目安は3万〜5万円。見積書のチェックポイント、過剰請求の見分け方、業者に確認すべき点まで具体的にまとめました。相場より高い見積もりの特徴と、値引き交渉で使える根拠を実例つきで解説しています。
souba/kaitai/index.html,141,相場入り/replace,解体工事の費用・相場を建設実務30年のプロがsouba-dbの実測データで解説します。適正相場の目安は3万〜6万円。相場より高い見積もりの特徴と、値引き交渉で使える根拠を実例つきで解説しています。梅(最安)・竹(標準)・松(大手)の3プランで、あなたの見積もりが適正か比較できます。
souba/kajou-seikyu-jirei-20/index.html,134,定型/replace,リフォーム・建設の過剰請求 実例20件データを建設実務30年のプロがsouba-dbの実測データで解説します。梅(最安)・竹(標準)・松(大手)の3プランで、あなたの見積もりが適正か比較できます。訪問販売の即決を断る方法や、相見積もりの取り方まであわせて確認できます。
souba/kanteisho-tsuite/index.html,136,定型/replace,建設費の適正価格を証明する書類はありますか？を建設実務30年のプロがsouba-dbの実測データで解説します。訪問販売の即決を断る方法や、相見積もりの取り方まであわせて確認できます。見積書のチェックポイント、過剰請求の見分け方、業者に確認すべき点まで具体的にまとめました。
souba/kasai-hoken/index.html,132,定型/replace,火災保険でリフォームできる？を建設実務30年のプロがsouba-dbの実測データで解説します。見積書のチェックポイント、過剰請求の見分け方、業者に確認すべき点まで具体的にまとめました。相場より高い見積もりの特徴と、値引き交渉で使える根拠を実例つきで解説しています。
souba/kenchiku-kyoka-bangou-shiraberu/index.html,135,定型/replace,建設業許可番号の調べ方を教えてくださいを建設実務30年のプロがsouba-dbの実測データで解説します。相場より高い見積もりの特徴と、値引き交渉で使える根拠を実例つきで解説しています。梅(最安)・竹(標準)・松(大手)の3プランで、あなたの見積もりが適正か比較できます。
souba/kensetsu-gyosha-shinrai-handan/index.html,131,定型/replace,業者が信頼できるかどうか調べる方法は？を建設実務30年のプロがsouba-dbの実測データで解説します。梅(最安)・竹(標準)・松(大手)の3プランで、あなたの見積もりが適正か比較できます。訪問販売の即決を断る方法や、相見積もりの取り方まであわせて確認できます。
souba/kitchen-100man-takai/index.html,153,相場入り/replace,キッチンリフォーム100万円は高いですか？を建設実務30年のプロがsouba-dbの実測データで解説します。適正相場の目安は80万〜150万円。訪問販売の即決を断る方法や、相見積もりの取り方まであわせて確認できます。見積書のチェックポイント、過剰請求の見分け方、業者に確認すべき点まで具体的にまとめました。
souba/kitchen-150man/index.html,157,相場入り/replace,キッチンリフォーム150万円は高いですか？を建設実務30年のプロがsouba-dbの実測データで解説します。適正相場の目安は80万〜150万円。見積書のチェックポイント、過剰請求の見分け方、業者に確認すべき点まで具体的にまとめました。相場より高い見積もりの特徴と、値引き交渉で使える根拠を実例つきで解説しています。
souba/kitchen/index.html,149,相場入り/replace,キッチンリフォームの費用・相場を建設実務30年のプロがsouba-dbの実測データで解説します。適正相場の目安は80万〜150万円。相場より高い見積もりの特徴と、値引き交渉で使える根拠を実例つきで解説しています。梅(最安)・竹(標準)・松(大手)の3プランで、あなたの見積もりが適正か比較できます。
souba/kodate-full-reno-100sqm/index.html,151,相場入り/replace,戸建て100㎡フルリノベーション費用を建設実務30年のプロがsouba-dbの実測データで解説します。適正相場の目安は2052万〜2758万円。梅(最安)・竹(標準)・松(大手)の3プランで、あなたの見積もりが適正か比較できます。訪問販売の即決を断る方法や、相見積もりの取り方まであわせて確認できます。
souba/kodate-full-reno-120sqm/index.html,153,相場入り/replace,戸建て120㎡フルリノベーション費用を建設実務30年のプロがsouba-dbの実測データで解説します。適正相場の目安は2276万〜3060万円。訪問販売の即決を断る方法や、相見積もりの取り方まであわせて確認できます。見積書のチェックポイント、過剰請求の見分け方、業者に確認すべき点まで具体的にまとめました。
souba/kodate-full-reno-60sqm/index.html,156,相場入り/replace,戸建て60㎡フルリノベーション費用を建設実務30年のプロがsouba-dbの実測データで解説します。適正相場の目安は1604万〜1976万円。見積書のチェックポイント、過剰請求の見分け方、業者に確認すべき点まで具体的にまとめました。相場より高い見積もりの特徴と、値引き交渉で使える根拠を実例つきで解説しています。
souba/kouji-chuu-trouble/index.html,129,定型/replace,リフォーム工事中のトラブルを建設実務30年のプロがsouba-dbの実測データで解説します。相場より高い見積もりの特徴と、値引き交渉で使える根拠を実例つきで解説しています。梅(最安)・竹(標準)・松(大手)の3プランで、あなたの見積もりが適正か比較できます。
souba/kyoyaku-konjitsu-kowai/index.html,140,定型/replace,今日契約しないと値段が上がると言われた。どうすればいい？を建設実務30年のプロがsouba-dbの実測データで解説します。梅(最安)・竹(標準)・松(大手)の3プランで、あなたの見積もりが適正か比較できます。訪問販売の即決を断る方法や、相見積もりの取り方まであわせて確認できます。
souba/kyuhaisuikan-check/index.html,157,相場入り/replace,給排水管・配管工事の見積もり、これ高い？相場2026を建設実務30年のプロがsouba-dbの実測データで解説します。適正相場の目安は30万〜80万円。訪問販売の即決を断る方法や、相見積もりの取り方まであわせて確認できます。見積書のチェックポイント、過剰請求の見分け方、業者に確認すべき点まで具体的にまとめました。
souba/kyutoki-kosho/index.html,147,相場入り/replace,給湯器故障・交換費用の相場を建設実務30年のプロがsouba-dbの実測データで解説します。適正相場の目安は8万〜15万円。見積書のチェックポイント、過剰請求の見分け方、業者に確認すべき点まで具体的にまとめました。相場より高い見積もりの特徴と、値引き交渉で使える根拠を実例つきで解説しています。
souba/kyutoki-koukanji-jikan/index.html,154,相場入り/replace,給湯器の交換にかかる時間はどれくらいですか？を建設実務30年のプロがsouba-dbの実測データで解説します。適正相場の目安は8万〜13万円。相場より高い見積もりの特徴と、値引き交渉で使える根拠を実例つきで解説しています。梅(最安)・竹(標準)・松(大手)の3プランで、あなたの見積もりが適正か比較できます。
souba/kyutoki-shinya-30man/index.html,120,相場入り/replace,給湯器が深夜に壊れて30万円請求された。高すぎませんか？を建設実務30年のプロがsouba-dbの実測データで解説します。適正相場の目安は8万〜15万円。梅(最安)・竹(標準)・松(大手)の3プランで、あなたの見積もりが適正か比較できます。
souba/loan/index.html,146,相場入り/replace,リフォームローンの金利相場を建設実務30年のプロがsouba-dbの実測データで解説します。適正相場の目安は200万〜300万円。訪問販売の即決を断る方法や、相見積もりの取り方まであわせて確認できます。見積書のチェックポイント、過剰請求の見分け方、業者に確認すべき点まで具体的にまとめました。
souba/mado/index.html,145,相場入り/replace,窓リフォーム費用の相場を建設実務30年のプロがsouba-dbの実測データで解説します。適正相場の目安は8万〜20万円。見積書のチェックポイント、過剰請求の見分け方、業者に確認すべき点まで具体的にまとめました。相場より高い見積もりの特徴と、値引き交渉で使える根拠を実例つきで解説しています。
souba/mitsumori-hikaku-shikata/index.html,138,定型/replace,見積もりを比較するにはどうすればいいですか？を建設実務30年のプロがsouba-dbの実測データで解説します。相場より高い見積もりの特徴と、値引き交渉で使える根拠を実例つきで解説しています。梅(最安)・竹(標準)・松(大手)の3プランで、あなたの見積もりが適正か比較できます。
souba/mitsumori-hikaku/index.html,125,定型/replace,相見積もりの正しい比較方法を建設実務30年のプロがsouba-dbの実測データで解説します。梅(最安)・竹(標準)・松(大手)の3プランで、あなたの見積もりが適正か比較できます。訪問販売の即決を断る方法や、相見積もりの取り方まであわせて確認できます。
souba/mitsumori-ichishiki/index.html,134,定型/replace,見積書に「一式」が多い。これって大丈夫？を建設実務30年のプロがsouba-dbの実測データで解説します。訪問販売の即決を断る方法や、相見積もりの取り方まであわせて確認できます。見積書のチェックポイント、過剰請求の見分け方、業者に確認すべき点まで具体的にまとめました。
souba/mitsumori-issiki/index.html,150,相場入り/replace,見積もりの「一式」は危険信号を建設実務30年のプロがsouba-dbの実測データで解説します。適正相場の目安は70万〜115万円。見積書のチェックポイント、過剰請求の見分け方、業者に確認すべき点まで具体的にまとめました。相場より高い見積もりの特徴と、値引き交渉で使える根拠を実例つきで解説しています。
souba/mitsumori-itsushika-kakenai/index.html,142,定型/replace,見積書に「一式」しか書いてない。これって普通ですか？を建設実務30年のプロがsouba-dbの実測データで解説します。相場より高い見積もりの特徴と、値引き交渉で使える根拠を実例つきで解説しています。梅(最安)・竹(標準)・松(大手)の3プランで、あなたの見積もりが適正か比較できます。
souba/naishou-tosou/index.html,138,相場入り/replace,内装塗装の費用・相場を建設実務30年のプロがsouba-dbの実測データで解説します。適正相場の目安は5万〜10万円。梅(最安)・竹(標準)・松(大手)の3プランで、あなたの見積もりが適正か比較できます。訪問販売の即決を断る方法や、相見積もりの取り方まであわせて確認できます。
souba/reform-100man/index.html,144,相場入り/replace,リフォーム100万円の相場を建設実務30年のプロがsouba-dbの実測データで解説します。適正相場の目安は55万〜90万円。訪問販売の即決を断る方法や、相見積もりの取り方まであわせて確認できます。見積書のチェックポイント、過剰請求の見分け方、業者に確認すべき点まで具体的にまとめました。
souba/renovation/index.html,120,相場入り/replace,マンション・戸建てリノベーションの費用・相場を建設実務30年のプロがsouba-dbの実測データで解説します。適正相場の目安は500万〜1200万円。見積書のチェックポイント、過剰請求の見分け方、業者に確認すべき点まで具体的にまとめました。
souba/roof-150man/index.html,149,相場入り/replace,屋根工事150万円は高いですか？を建設実務30年のプロがsouba-dbの実測データで解説します。適正相場の目安は30万〜80万円。相場より高い見積もりの特徴と、値引き交渉で使える根拠を実例つきで解説しています。梅(最安)・竹(標準)・松(大手)の3プランで、あなたの見積もりが適正か比較できます。
souba/roof/index.html,139,相場入り/replace,屋根工事の費用・相場を建設実務30年のプロがsouba-dbの実測データで解説します。適正相場の目安は30万〜80万円。梅(最安)・竹(標準)・松(大手)の3プランで、あなたの見積もりが適正か比較できます。訪問販売の即決を断る方法や、相見積もりの取り方まであわせて確認できます。
