file,字数,種別,new_desc
movement-us/index.html,159,定型/replace,"A former carpenter open-sourced 65,729 construction cost items and anchored them to Bitcoin so no one can fake the numbers. Not a politician. Not a lawyer. We."
negotiate.html,125,定型/insert,見積書交渉サポートを建設実務30年のプロがsouba-dbの実測データで解説します。相場より高い見積もりの特徴と、値引き交渉で使える根拠を実例つきで解説しています。梅(最安)・竹(標準)・松(大手)の3プランで、あなたの見積もりが適正か比較できます。
negotiate/index.html,121,定型/replace,見積書交渉サポートを建設実務30年のプロがsouba-dbの実測データで解説します。梅(最安)・竹(標準)・松(大手)の3プランで、あなたの見積もりが適正か比較できます。訪問販売の即決を断る方法や、相見積もりの取り方まであわせて確認できます。
privacy.html,126,定型/insert,プライバシーポリシーを建設実務30年のプロがsouba-dbの実測データで解説します。相場より高い見積もりの特徴と、値引き交渉で使える根拠を実例つきで解説しています。梅(最安)・竹(標準)・松(大手)の3プランで、あなたの見積もりが適正か比較できます。
proposal-en/index.html,126,定型/replace,HORIZON SHIELD — A Design Where All 12 Players Winを建設実務30年のプロがsouba-dbの実測データで解説します。梅(最安)・竹(標準)・松(大手)の3プランで、あなたの見積もりが適正か比較できます。
quotes/index.html,154,定型/replace,"Quotations from TOshi Oga (Toshikatsu Oga), a carpenter of thirty years who taught himself AI and built an open construction-cost database. No titles. No."
reverse-estimate/index.html,128,定型/replace,逆見積もり診断 v4を建設実務30年のプロがsouba-dbの実測データで解説します。見積書のチェックポイント、過剰請求の見分け方、業者に確認すべき点まで具体的にまとめました。相場より高い見積もりの特徴と、値引き交渉で使える根拠を実例つきで解説しています。
shindan.html,122,定型/insert,0円簡易診断を建設実務30年のプロがsouba-dbの実測データで解説します。相場より高い見積もりの特徴と、値引き交渉で使える根拠を実例つきで解説しています。梅(最安)・竹(標準)・松(大手)の3プランで、あなたの見積もりが適正か比較できます。
souba-konkyo.html,129,相場入り/replace,リフォーム相場の「根拠」には2種類ある ― あなたが見るべきはどちらかを建設実務30年のプロがsouba-dbの実測データで解説します。適正相場の目安は50万〜150万円。梅(最安)・竹(標準)・松(大手)の3プランで、あなたの見積もりが適正か比較できます。
souba.html,156,相場入り/replace,建設費・リフォーム相場データベース 2026年版を建設実務30年のプロがsouba-dbの実測データで解説します。適正相場の目安は80万〜150万円。訪問販売の即決を断る方法や、相見積もりの取り方まであわせて確認できます。見積書のチェックポイント、過剰請求の見分け方、業者に確認すべき点まで具体的にまとめました。
souba/aimitsumori-tekisei-kakaku/index.html,147,定型/replace,相見積もりを3社取っても「適正価格」が分からない本当の理由を建設実務30年のプロがsouba-dbの実測データで解説します。見積書のチェックポイント、過剰請求の見分け方、業者に確認すべき点まで具体的にまとめました。相場より高い見積もりの特徴と、値引き交渉で使える根拠を実例つきで解説しています。
souba/aimitsumori/index.html,133,定型/replace,リフォームの相見積もりは何社必要？を建設実務30年のプロがsouba-dbの実測データで解説します。相場より高い見積もりの特徴と、値引き交渉で使える根拠を実例つきで解説しています。梅(最安)・竹(標準)・松(大手)の3プランで、あなたの見積もりが適正か比較できます。
souba/aircon-kosho/index.html,145,相場入り/replace,エアコン故障・修理・交換費用の相場を建設実務30年のプロがsouba-dbの実測データで解説します。適正相場の目安は8万〜20万円。梅(最安)・竹(標準)・松(大手)の3プランで、あなたの見積もりが適正か比較できます。訪問販売の即決を断る方法や、相見積もりの取り方まであわせて確認できます。
souba/aircon/index.html,144,相場入り/replace,エアコン設置・交換の費用・相場を建設実務30年のプロがsouba-dbの実測データで解説します。適正相場の目安は2万〜5万円。訪問販売の即決を断る方法や、相見積もりの取り方まであわせて確認できます。見積書のチェックポイント、過剰請求の見分け方、業者に確認すべき点まで具体的にまとめました。
souba/amamori-check/index.html,122,相場入り/replace,雨漏り修理の見積もり、これ高い？『今すぐ』訪問販売に注意を建設実務30年のプロがsouba-dbの実測データで解説します。適正相場の目安は3万〜30万円。見積書のチェックポイント、過剰請求の見分け方、業者に確認すべき点まで具体的にまとめました。
souba/amamori/index.html,143,相場入り/replace,雨漏り修理の費用・相場を建設実務30年のプロがsouba-dbの実測データで解説します。適正相場の目安は5万〜30万円。相場より高い見積もりの特徴と、値引き交渉で使える根拠を実例つきで解説しています。梅(最安)・竹(標準)・松(大手)の3プランで、あなたの見積もりが適正か比較できます。
souba/amido-amado/index.html,148,相場入り/replace,網戸・雨戸・シャッター交換の費用・相場を建設実務30年のプロがsouba-dbの実測データで解説します。適正相場の目安は15万〜35万円。梅(最安)・竹(標準)・松(大手)の3プランで、あなたの見積もりが適正か比較できます。訪問販売の即決を断る方法や、相見積もりの取り方まであわせて確認できます。
souba/ashiba-handan/index.html,144,相場入り/replace,足場が必要か高所作業車でいいかを建設実務30年のプロがsouba-dbの実測データで解説します。適正相場の目安は3万〜5万円。訪問販売の即決を断る方法や、相見積もりの取り方まであわせて確認できます。見積書のチェックポイント、過剰請求の見分け方、業者に確認すべき点まで具体的にまとめました。
souba/ashiba-ryoukin-takai/index.html,155,相場入り/replace,足場代が高すぎます。相場はいくらですか？を建設実務30年のプロがsouba-dbの実測データで解説します。適正相場の目安は10万〜18万円。見積書のチェックポイント、過剰請求の見分け方、業者に確認すべき点まで具体的にまとめました。相場より高い見積もりの特徴と、値引き交渉で使える根拠を実例つきで解説しています。
souba/ashiyu-unit/index.html,148,相場入り/replace,足湯設備工事の適正価格・相場を建設実務30年のプロがsouba-dbの実測データで解説します。適正相場の目安は85万〜210万円。相場より高い見積もりの特徴と、値引き交渉で使える根拠を実例つきで解説しています。梅(最安)・竹(標準)・松(大手)の3プランで、あなたの見積もりが適正か比較できます。
souba/bankin/index.html,140,相場入り/replace,屋根板金工事の費用・相場を建設実務30年のプロがsouba-dbの実測データで解説します。適正相場の目安は5万〜15万円。梅(最安)・竹(標準)・松(大手)の3プランで、あなたの見積もりが適正か比較できます。訪問販売の即決を断る方法や、相見積もりの取り方まであわせて確認できます。
souba/barrier-free-reform/index.html,140,定型/replace,バリアフリーリフォームの費用と補助金を教えてくださいを建設実務30年のプロがsouba-dbの実測データで解説します。訪問販売の即決を断る方法や、相見積もりの取り方まであわせて確認できます。見積書のチェックポイント、過剰請求の見分け方、業者に確認すべき点まで具体的にまとめました。
souba/barrier-free/index.html,150,相場入り/replace,バリアフリー・介護改修の費用・相場を建設実務30年のプロがsouba-dbの実測データで解説します。適正相場の目安は3万〜8万円。見積書のチェックポイント、過剰請求の見分け方、業者に確認すべき点まで具体的にまとめました。相場より高い見積もりの特徴と、値引き交渉で使える根拠を実例つきで解説しています。
souba/bath-100man/index.html,153,相場入り/replace,浴室リフォーム100万円は高いですか？を建設実務30年のプロがsouba-dbの実測データで解説します。適正相場の目安は60万〜120万円。相場より高い見積もりの特徴と、値引き交渉で使える根拠を実例つきで解説しています。梅(最安)・竹(標準)・松(大手)の3プランで、あなたの見積もりが適正か比較できます。
souba/bath-check/index.html,122,相場入り/replace,浴室リフォームの見積もり、これ高い？今すぐ無料でAI診断を建設実務30年のプロがsouba-dbの実測データで解説します。適正相場の目安は60万〜110万円。梅(最安)・竹(標準)・松(大手)の3プランで、あなたの見積もりが適正か比較できます。
souba/bath-reform-100man/index.html,151,相場入り/replace,浴室リフォーム100万円は適正ですか？を建設実務30年のプロがsouba-dbの実測データで解説します。適正相場の目安は60万〜120万円。訪問販売の即決を断る方法や、相見積もりの取り方まであわせて確認できます。見積書のチェックポイント、過剰請求の見分け方、業者に確認すべき点まで具体的にまとめました。
souba/bath/index.html,149,相場入り/replace,浴室リフォームの費用・相場を建設実務30年のプロがsouba-dbの実測データで解説します。適正相場の目安は60万〜120万円。見積書のチェックポイント、過剰請求の見分け方、業者に確認すべき点まで具体的にまとめました。相場より高い見積もりの特徴と、値引き交渉で使える根拠を実例つきで解説しています。
souba/benjo-tsumari/index.html,144,相場入り/replace,トイレ詰まり修理費用の相場を建設実務30年のプロがsouba-dbの実測データで解説します。適正相場の目安は1万〜3万円。相場より高い見積もりの特徴と、値引き交渉で使える根拠を実例つきで解説しています。梅(最安)・竹(標準)・松(大手)の3プランで、あなたの見積もりが適正か比較できます。
souba/chikashitsu-kyotsu-hitsuyou/index.html,154,相場入り/replace,床下の調査が必要と言われました。信用していいですか？を建設実務30年のプロがsouba-dbの実測データで解説します。適正相場の目安は5万〜10万円。梅(最安)・竹(標準)・松(大手)の3プランで、あなたの見積もりが適正か比較できます。訪問販売の即決を断る方法や、相見積もりの取り方まであわせて確認できます。
souba/cloth/index.html,144,相場入り/replace,クロス・壁紙張替えの費用・相場を建設実務30年のプロがsouba-dbの実測データで解説します。適正相場の目安は3万〜5万円。訪問販売の即決を断る方法や、相見積もりの取り方まであわせて確認できます。見積書のチェックポイント、過剰請求の見分け方、業者に確認すべき点まで具体的にまとめました。
souba/cooling-off-gaiheki/index.html,146,定型/replace,外壁塗装のクーリングオフはできますか？期間は何日ですか？を建設実務30年のプロがsouba-dbの実測データで解説します。見積書のチェックポイント、過剰請求の見分け方、業者に確認すべき点まで具体的にまとめました。相場より高い見積もりの特徴と、値引き交渉で使える根拠を実例つきで解説しています。
souba/dantsu/index.html,149,相場入り/replace,断熱・内窓リフォームの費用・相場を建設実務30年のプロがsouba-dbの実測データで解説します。適正相場の目安は10万〜50万円。相場より高い見積もりの特徴と、値引き交渉で使える根拠を実例つきで解説しています。梅(最安)・竹(標準)・松(大手)の3プランで、あなたの見積もりが適正か比較できます。
souba/ecocute-houmonhanbai/index.html,123,相場入り/replace,訪問販売のエコキュートが80万円。本体の原価はいくらですか？を建設実務30年のプロがsouba-dbの実測データで解説します。適正相場の目安は23万〜26万円。梅(最安)・竹(標準)・松(大手)の3プランで、あなたの見積もりが適正か比較できます。
souba/flooring/index.html,146,相場入り/replace,フローリング張替えの費用・相場を建設実務30年のプロがsouba-dbの実測データで解説します。適正相場の目安は10万〜20万円。訪問販売の即決を断る方法や、相見積もりの取り方まであわせて確認できます。見積書のチェックポイント、過剰請求の見分け方、業者に確認すべき点まで具体的にまとめました。
souba/fuyujimai/index.html,146,相場入り/replace,冬支度リフォーム詐欺を建設実務30年のプロがsouba-dbの実測データで解説します。適正相場の目安は80万〜150万円。見積書のチェックポイント、過剰請求の見分け方、業者に確認すべき点まで具体的にまとめました。相場より高い見積もりの特徴と、値引き交渉で使える根拠を実例つきで解説しています。
souba/gaiheki-100man/index.html,147,相場入り/replace,外壁塗装100万円は高い？を建設実務30年のプロがsouba-dbの実測データで解説します。適正相場の目安は80万〜120万円。相場より高い見積もりの特徴と、値引き交渉で使える根拠を実例つきで解説しています。梅(最安)・竹(標準)・松(大手)の3プランで、あなたの見積もりが適正か比較できます。
souba/gaiheki-150man-takai/index.html,147,相場入り/replace,外壁塗装150万円って高いですか？を建設実務30年のプロがsouba-dbの実測データで解説します。適正相場の目安は80万〜120万円。梅(最安)・竹(標準)・松(大手)の3プランで、あなたの見積もりが適正か比較できます。訪問販売の即決を断る方法や、相見積もりの取り方まであわせて確認できます。
souba/gaiheki-150man/index.html,148,相場入り/replace,外壁塗装150万円は高いですか？を建設実務30年のプロがsouba-dbの実測データで解説します。適正相場の目安は80万〜120万円。訪問販売の即決を断る方法や、相見積もりの取り方まであわせて確認できます。見積書のチェックポイント、過剰請求の見分け方、業者に確認すべき点まで具体的にまとめました。
souba/gaiheki-200man/index.html,152,相場入り/replace,外壁塗装200万円は高いですか？を建設実務30年のプロがsouba-dbの実測データで解説します。適正相場の目安は80万〜150万円。見積書のチェックポイント、過剰請求の見分け方、業者に確認すべき点まで具体的にまとめました。相場より高い見積もりの特徴と、値引き交渉で使える根拠を実例つきで解説しています。
souba/gaiheki-50man/index.html,131,定型/replace,外壁塗装50万円は高い？安い？を建設実務30年のプロがsouba-dbの実測データで解説します。相場より高い見積もりの特徴と、値引き交渉で使える根拠を実例つきで解説しています。梅(最安)・竹(標準)・松(大手)の3プランで、あなたの見積もりが適正か比較できます。
souba/gaiheki-80man/index.html,144,相場入り/replace,外壁塗装80万円は高い？安い？を建設実務30年のプロがsouba-dbの実測データで解説します。適正相場の目安は20万〜40万円。梅(最安)・竹(標準)・松(大手)の3プランで、あなたの見積もりが適正か比較できます。訪問販売の即決を断る方法や、相見積もりの取り方まであわせて確認できます。
souba/gaiheki-check/index.html,157,相場入り/replace,外壁塗装の見積もり、これ高い？今すぐ無料でAI診断を建設実務30年のプロがsouba-dbの実測データで解説します。適正相場の目安は80万〜150万円。訪問販売の即決を断る方法や、相見積もりの取り方まであわせて確認できます。見積書のチェックポイント、過剰請求の見分け方、業者に確認すべき点まで具体的にまとめました。
souba/gaiheki-hyogo/index.html,158,定型/replace,"兵庫県の外壁塗装の適正価格を建設実務30年のプロが公開。シリコン㎡2,438〜3,710円、30坪一式74.2万〜121.9万円(中央95.4万)。塗料4グレード別㎡単価、面積別(20〜40坪)、劣化症状の見極め、外壁材別の注意、塩害地域の対策、SHA-256で誰でも検証できるPTKA基準、見積もり130万円の診断"
souba/gaiheki-kajou-seikyu/index.html,130,定型/replace,外壁塗装の過剰請求の見分け方を建設実務30年のプロがsouba-dbの実測データで解説します。相場より高い見積もりの特徴と、値引き交渉で使える根拠を実例つきで解説しています。梅(最安)・竹(標準)・松(大手)の3プランで、あなたの見積もりが適正か比較できます。
souba/gaiheki-nuri-kai-hitsuyou/index.html,140,定型/replace,外壁塗装は本当に必要ですか？しなかったらどうなりますか？を建設実務30年のプロがsouba-dbの実測データで解説します。梅(最安)・竹(標準)・松(大手)の3プランで、あなたの見積もりが適正か比較できます。訪問販売の即決を断る方法や、相見積もりの取り方まであわせて確認できます。
souba/gaiheki-nuru-jiki/index.html,132,定型/replace,外壁塗装の時期はいつがベストですか？を建設実務30年のプロがsouba-dbの実測データで解説します。訪問販売の即決を断る方法や、相見積もりの取り方まであわせて確認できます。見積書のチェックポイント、過剰請求の見分け方、業者に確認すべき点まで具体的にまとめました。
souba/gaiheki-tokyo/index.html,158,定型/replace,"東京都の外壁塗装の適正価格を建設実務30年のプロが公開。シリコン㎡2,530〜3,850円、30坪一式77.0万〜126.5万円(中央99.0万)。塗料4グレード別㎡単価、面積別(20〜40坪)、劣化症状の見極め、外壁材別の注意、都市部の狭小地足場・排ガス汚れ対策、SHA-256で検証できるPTKA基準、見積もり1"
souba/gaiheki/index.html,146,相場入り/replace,外壁塗装の相場・適正価格を建設実務30年のプロがsouba-dbの実測データで解説します。適正相場の目安は80万〜150万円。相場より高い見積もりの特徴と、値引き交渉で使える根拠を実例つきで解説しています。梅(最安)・竹(標準)・松(大手)の3プランで、あなたの見積もりが適正か比較できます。
souba/gaiko/index.html,139,相場入り/replace,外構工事の費用・相場を建設実務30年のプロがsouba-dbの実測データで解説します。適正相場の目安は24万〜45万円。梅(最安)・竹(標準)・松(大手)の3プランで、あなたの見積もりが適正か比較できます。訪問販売の即決を断る方法や、相見積もりの取り方まであわせて確認できます。
souba/genjo-kaifuku-kijun/index.html,130,定型/replace,原状回復の範囲はどこまでですか？を建設実務30年のプロがsouba-dbの実測データで解説します。訪問販売の即決を断る方法や、相見積もりの取り方まであわせて確認できます。見積書のチェックポイント、過剰請求の見分け方、業者に確認すべき点まで具体的にまとめました。
souba/genkan/index.html,147,相場入り/replace,玄関ドア交換の費用・相場を建設実務30年のプロがsouba-dbの実測データで解説します。適正相場の目安は20万〜50万円。見積書のチェックポイント、過剰請求の見分け方、業者に確認すべき点まで具体的にまとめました。相場より高い見積もりの特徴と、値引き交渉で使える根拠を実例つきで解説しています。
souba/gyosha-erabi/index.html,127,定型/replace,リフォーム業者の選び方を建設実務30年のプロがsouba-dbの実測データで解説します。相場より高い見積もりの特徴と、値引き交渉で使える根拠を実例つきで解説しています。梅(最安)・竹(標準)・松(大手)の3プランで、あなたの見積もりが適正か比較できます。
souba/gyosha-kyukaseru/index.html,138,定型/replace,リフォーム業者に急かされている。契約していいですか？を建設実務30年のプロがsouba-dbの実測データで解説します。梅(最安)・竹(標準)・松(大手)の3プランで、あなたの見積もりが適正か比較できます。訪問販売の即決を断る方法や、相見積もりの取り方まであわせて確認できます。
souba/haikan/index.html,144,相場入り/replace,給排水配管工事の費用・相場を建設実務30年のプロがsouba-dbの実測データで解説します。適正相場の目安は30万〜80万円。訪問販売の即決を断る方法や、相見積もりの取り方まであわせて確認できます。見積書のチェックポイント、過剰請求の見分け方、業者に確認すべき点まで具体的にまとめました。
souba/hoken-saiken/index.html,142,相場入り/replace,火災保険申請詐欺を建設実務30年のプロがsouba-dbの実測データで解説します。適正相場の目安は3万〜20万円。見積書のチェックポイント、過剰請求の見分け方、業者に確認すべき点まで具体的にまとめました。相場より高い見積もりの特徴と、値引き交渉で使える根拠を実例つきで解説しています。
souba/houjin-reform-mitsumori/index.html,154,相場入り/replace,店舗の内装工事見積もりが高すぎる気がしますを建設実務30年のプロがsouba-dbの実測データで解説します。適正相場の目安は30万〜60万円。相場より高い見積もりの特徴と、値引き交渉で使える根拠を実例つきで解説しています。梅(最安)・竹(標準)・松(大手)の3プランで、あなたの見積もりが適正か比較できます。
souba/index.html,129,定型/replace,建設費・リフォーム相場データベースを建設実務30年のプロがsouba-dbの実測データで解説します。梅(最安)・竹(標準)・松(大手)の3プランで、あなたの見積もりが適正か比較できます。訪問販売の即決を断る方法や、相見積もりの取り方まであわせて確認できます。
souba/jirei/card-1780663060159/index.html,140,定型/replace,"の事務所改装工事一式 ¥1,100,000 は適正かを建設実務30年のプロがsouba-dbの実測データで解説します。訪問販売の即決を断る方法や、相見積もりの取り方まであわせて確認できます。見積書のチェックポイント、過剰請求の見分け方、業者に確認すべき点まで具体的にまとめました。"
souba/jirei/card-1780969841775/index.html,142,定型/replace,"茨城県の鉄骨塗装工事 ¥103,000 は適正かを建設実務30年のプロがsouba-dbの実測データで解説します。見積書のチェックポイント、過剰請求の見分け方、業者に確認すべき点まで具体的にまとめました。相場より高い見積もりの特徴と、値引き交渉で使える根拠を実例つきで解説しています。"
souba/jirei/card-1780970026604/index.html,147,定型/replace,"東京都のクリアミラー製作・取付工事 ¥434,500 は適正かを建設実務30年のプロがsouba-dbの実測データで解説します。相場より高い見積もりの特徴と、値引き交渉で使える根拠を実例つきで解説しています。梅(最安)・竹(標準)・松(大手)の3プランで、あなたの見積もりが適正か比較できます。"
