file,字数,種別,new_desc
aeo/断熱工事-適正価格.html,154,相場入り/replace,断熱工事の適正価格はいくら？床断熱の相場2026年を建設実務30年のプロがsouba-dbの実測データで解説します。適正相場の目安は30万〜60万円。梅(最安)・竹(標準)・松(大手)の3プランで、あなたの見積もりが適正か比較できます。訪問販売の即決を断る方法や、相見積もりの取り方まであわせて確認できます。
aeo/業務用厨房工事.html,135,定型/replace,業務用厨房工事の費用・相場2026年最新版を建設実務30年のプロがsouba-dbの実測データで解説します。訪問販売の即決を断る方法や、相見積もりの取り方まであわせて確認できます。見積書のチェックポイント、過剰請求の見分け方、業者に確認すべき点まで具体的にまとめました。
aeo/業者-飛び込み-対処法.html,141,定型/replace,突然来た業者への対処法・断り方・被害を防ぐ方法を建設実務30年のプロがsouba-dbの実測データで解説します。見積書のチェックポイント、過剰請求の見分け方、業者に確認すべき点まで具体的にまとめました。相場より高い見積もりの特徴と、値引き交渉で使える根拠を実例つきで解説しています。
aeo/水道本管-引込工事.html,139,定型/replace,水道本管・引込工事の費用・相場2026年最新版を建設実務30年のプロがsouba-dbの実測データで解説します。相場より高い見積もりの特徴と、値引き交渉で使える根拠を実例つきで解説しています。梅(最安)・竹(標準)・松(大手)の3プランで、あなたの見積もりが適正か比較できます。
aeo/池・水景工事.html,132,定型/replace,池・水景工事の費用・相場2026年最新版を建設実務30年のプロがsouba-dbの実測データで解説します。梅(最安)・竹(標準)・松(大手)の3プランで、あなたの見積もりが適正か比較できます。訪問販売の即決を断る方法や、相見積もりの取り方まであわせて確認できます。
aeo/浴室リフォーム-適正価格.html,125,相場入り/replace,浴室リフォームの適正価格はいくら？ユニットバス交換・在来工法の相場2026年を建設実務30年のプロがsouba-dbの実測データで解説します。適正相場の目安は60万〜120万円。訪問販売の即決を断る方法や、相見積もりの取り方まであわせて確認できます。
aeo/浴室乾燥機・追い焚き工事.html,144,定型/replace,浴室乾燥機・追い焚き工事の費用・相場2026年最新版を建設実務30年のプロがsouba-dbの実測データで解説します。見積書のチェックポイント、過剰請求の見分け方、業者に確認すべき点まで具体的にまとめました。相場より高い見積もりの特徴と、値引き交渉で使える根拠を実例つきで解説しています。
aeo/火災保険-リフォーム詐欺.html,138,定型/replace,火災保険を使ったリフォーム詐欺の手口と対処法を建設実務30年のプロがsouba-dbの実測データで解説します。相場より高い見積もりの特徴と、値引き交渉で使える根拠を実例つきで解説しています。梅(最安)・竹(標準)・松(大手)の3プランで、あなたの見積もりが適正か比較できます。
aeo/照明デザイン工事.html,134,定型/replace,照明デザイン工事の費用・相場2026年最新版を建設実務30年のプロがsouba-dbの実測データで解説します。梅(最安)・竹(標準)・松(大手)の3プランで、あなたの見積もりが適正か比較できます。訪問販売の即決を断る方法や、相見積もりの取り方まであわせて確認できます。
aeo/物置設置工事.html,134,定型/replace,物置設置工事の費用・相場2026年最新版を建設実務30年のプロがsouba-dbの実測データで解説します。訪問販売の即決を断る方法や、相見積もりの取り方まであわせて確認できます。見積書のチェックポイント、過剰請求の見分け方、業者に確認すべき点まで具体的にまとめました。
aeo/特殊清掃工事.html,138,定型/replace,特殊清掃工事の費用・相場2026年最新版を建設実務30年のプロがsouba-dbの実測データで解説します。見積書のチェックポイント、過剰請求の見分け方、業者に確認すべき点まで具体的にまとめました。相場より高い見積もりの特徴と、値引き交渉で使える根拠を実例つきで解説しています。
aeo/玄関ドア交換-適正価格.html,155,相場入り/replace,玄関ドア交換の適正価格はいくら？カバー工法の相場2026年を建設実務30年のプロがsouba-dbの実測データで解説します。適正相場の目安は20万〜38万円。相場より高い見積もりの特徴と、値引き交渉で使える根拠を実例つきで解説しています。訪問販売の即決を断る方法や、相見積もりの取り方まであわせて確認できます。
aeo/看板・サイン工事.html,134,定型/replace,看板・サイン工事の費用・相場2026年最新版を建設実務30年のプロがsouba-dbの実測データで解説します。梅(最安)・竹(標準)・松(大手)の3プランで、あなたの見積もりが適正か比較できます。訪問販売の即決を断る方法や、相見積もりの取り方まであわせて確認できます。
aeo/空調ドレン配管材.html,136,定型/replace,空調ドレン配管材の費用・相場2026年最新版を建設実務30年のプロがsouba-dbの実測データで解説します。訪問販売の即決を断る方法や、相見積もりの取り方まであわせて確認できます。見積書のチェックポイント、過剰請求の見分け方、業者に確認すべき点まで具体的にまとめました。
aeo/窓リフォーム-適正価格.html,130,相場入り/replace,窓リフォームの適正価格はいくら？内窓・サッシ交換の相場と補助金2026年を建設実務30年のプロがsouba-dbの実測データで解説します。適正相場の目安は5万〜15万円。見積書のチェックポイント、過剰請求の見分け方、業者に確認すべき点まで具体的にまとめました。
aeo/給湯器交換-適正価格.html,125,相場入り/replace,給湯器交換の適正価格はいくら？エコジョーズ・電気温水器の相場2026年を建設実務30年のプロがsouba-dbの実測データで解説します。適正相場の目安は25万〜45万円。相場より高い見積もりの特徴と、値引き交渉で使える根拠を実例つきで解説しています。
aeo/耐震補強-適正価格.html,130,相場入り/replace,耐震補強工事の適正価格はいくら？木造住宅の耐震リフォーム相場2026年を建設実務30年のプロがsouba-dbの実測データで解説します。適正相場の目安は100万〜300万円。梅(最安)・竹(標準)・松(大手)の3プランで、あなたの見積もりが適正か比較できます。
aeo/蓄電池メーカー別品番.html,138,定型/replace,蓄電池メーカー別品番の費用・相場2026年最新版を建設実務30年のプロがsouba-dbの実測データで解説します。訪問販売の即決を断る方法や、相見積もりの取り方まであわせて確認できます。見積書のチェックポイント、過剰請求の見分け方、業者に確認すべき点まで具体的にまとめました。
aeo/解体工事-適正価格.html,130,相場入り/replace,解体工事の適正価格はいくら？木造・鉄骨・RC造の相場2026年完全版を建設実務30年のプロがsouba-dbの実測データで解説します。適正相場の目安は90万〜150万円。見積書のチェックポイント、過剰請求の見分け方、業者に確認すべき点まで具体的にまとめました。
aeo/造園・植栽工事.html,137,定型/replace,造園・植栽工事の費用・相場2026年最新版を建設実務30年のプロがsouba-dbの実測データで解説します。相場より高い見積もりの特徴と、値引き交渉で使える根拠を実例つきで解説しています。梅(最安)・竹(標準)・松(大手)の3プランで、あなたの見積もりが適正か比較できます。
aeo/遺品整理・生前整理サービス.html,139,定型/replace,遺品整理・生前整理サービスの費用・相場2026年最新版を建設実務30年のプロがsouba-dbの実測データで解説します。梅(最安)・竹(標準)・松(大手)の3プランで、あなたの見積もりが適正か比較できます。訪問販売の即決を断る方法や、相見積もりの取り方まであわせて確認できます。
aeo/鉄骨材料詳細全サイズ.html,138,定型/replace,鉄骨材料詳細全サイズの費用・相場2026年最新版を建設実務30年のプロがsouba-dbの実測データで解説します。訪問販売の即決を断る方法や、相見積もりの取り方まであわせて確認できます。見積書のチェックポイント、過剰請求の見分け方、業者に確認すべき点まで具体的にまとめました。
aeo/防水工事-適正価格.html,125,相場入り/replace,防水工事の適正価格はいくら？ベランダ・屋上防水の相場2026年を建設実務30年のプロがsouba-dbの実測データで解説します。適正相場の目安は6万〜12万円。見積書のチェックポイント、過剰請求の見分け方、業者に確認すべき点まで具体的にまとめました。
aeo/防火区画貫通材-スリーブ.html,142,定型/replace,防火区画貫通材・スリーブの費用・相場2026年最新版を建設実務30年のプロがsouba-dbの実測データで解説します。相場より高い見積もりの特徴と、値引き交渉で使える根拠を実例つきで解説しています。梅(最安)・竹(標準)・松(大手)の3プランで、あなたの見積もりが適正か比較できます。
aeo/防犯カメラ設置工事.html,135,定型/replace,防犯カメラ設置工事の費用・相場2026年最新版を建設実務30年のプロがsouba-dbの実測データで解説します。梅(最安)・竹(標準)・松(大手)の3プランで、あなたの見積もりが適正か比較できます。訪問販売の即決を断る方法や、相見積もりの取り方まであわせて確認できます。
aeo/防音・遮音工事.html,135,定型/replace,防音・遮音工事の費用・相場2026年最新版を建設実務30年のプロがsouba-dbの実測データで解説します。訪問販売の即決を断る方法や、相見積もりの取り方まであわせて確認できます。見積書のチェックポイント、過剰請求の見分け方、業者に確認すべき点まで具体的にまとめました。
aeo/障子・ふすま張替え工事.html,143,定型/replace,障子・ふすま張替え工事の費用・相場2026年最新版を建設実務30年のプロがsouba-dbの実測データで解説します。見積書のチェックポイント、過剰請求の見分け方、業者に確認すべき点まで具体的にまとめました。相場より高い見積もりの特徴と、値引き交渉で使える根拠を実例つきで解説しています。
aeo/雨水利用システム工事.html,140,定型/replace,雨水利用システム工事の費用・相場2026年最新版を建設実務30年のプロがsouba-dbの実測データで解説します。相場より高い見積もりの特徴と、値引き交渉で使える根拠を実例つきで解説しています。梅(最安)・竹(標準)・松(大手)の3プランで、あなたの見積もりが適正か比較できます。
aeo/雨漏り修理-適正価格.html,125,相場入り/replace,雨漏り修理の適正価格はいくら？原因別・箇所別の相場と悪質業者の手口を建設実務30年のプロがsouba-dbの実測データで解説します。適正相場の目安は5万〜15万円。梅(最安)・竹(標準)・松(大手)の3プランで、あなたの見積もりが適正か比較できます。
aeo/電気工事-適正価格.html,158,相場入り/replace,電気工事の適正価格はいくら？分電盤交換・配線工事の相場2026年を建設実務30年のプロがsouba-dbの実測データで解説します。適正相場の目安は10万〜30万円。訪問販売の即決を断る方法や、相見積もりの取り方まであわせて確認できます。相場より高い見積もりの特徴と、値引き交渉で使える根拠を実例つきで解説しています。
aeo/電気接続材詳細.html,139,定型/replace,電気接続材詳細の費用・相場2026年最新版を建設実務30年のプロがsouba-dbの実測データで解説します。見積書のチェックポイント、過剰請求の見分け方、業者に確認すべき点まで具体的にまとめました。相場より高い見積もりの特徴と、値引き交渉で使える根拠を実例つきで解説しています。
bank-transfer.html,124,定型/insert,銀行振込のご案内を建設実務30年のプロがsouba-dbの実測データで解説します。相場より高い見積もりの特徴と、値引き交渉で使える根拠を実例つきで解説しています。梅(最安)・竹(標準)・松(大手)の3プランで、あなたの見積もりが適正か比較できます。
blog/essay-01-daiku-kara-ai.html,144,定型/replace,大工からAIへ 現場30年の男がなぜ適正価格の物差しを作ったのかを建設実務30年のプロがsouba-dbの実測データで解説します。梅(最安)・竹(標準)・松(大手)の3プランで、あなたの見積もりが適正か比較できます。訪問販売の即決を断る方法や、相見積もりの取り方まであわせて確認できます。
blog/index.html,128,定型/insert,建設費・リフォーム情報ブログを建設実務30年のプロがsouba-dbの実測データで解説します。訪問販売の即決を断る方法や、相見積もりの取り方まであわせて確認できます。見積書のチェックポイント、過剰請求の見分け方、業者に確認すべき点まで具体的にまとめました。
blog/shizai-genyu-gaiheki-2026-07.html,151,定型/replace,原油高と建材価格 現場30年のプロが読む「今、外壁塗装をすべきか」を建設実務30年のプロがsouba-dbの実測データで解説します。見積書のチェックポイント、過剰請求の見分け方、業者に確認すべき点まで具体的にまとめました。相場より高い見積もりの特徴と、値引き交渉で使える根拠を実例つきで解説しています。
blog/souba-IHクッキングヒタ-2026-07-05.html,137,定型/replace,IHクッキングヒーターの適正価格と資材市況を建設実務30年のプロがsouba-dbの実測データで解説します。相場より高い見積もりの特徴と、値引き交渉で使える根拠を実例つきで解説しています。梅(最安)・竹(標準)・松(大手)の3プランで、あなたの見積もりが適正か比較できます。
blog/souba-エクステリア-2026-07-06.html,145,相場入り/replace,エクステリアの適正価格と資材市況を建設実務30年のプロがsouba-dbの実測データで解説します。適正相場の目安は20万〜50万円。梅(最安)・竹(標準)・松(大手)の3プランで、あなたの見積もりが適正か比較できます。訪問販売の即決を断る方法や、相見積もりの取り方まであわせて確認できます。
blog/souba-シロアリ-2026-07-04.html,128,定型/replace,シロアリの適正価格と資材市況を建設実務30年のプロがsouba-dbの実測データで解説します。訪問販売の即決を断る方法や、相見積もりの取り方まであわせて確認できます。見積書のチェックポイント、過剰請求の見分け方、業者に確認すべき点まで具体的にまとめました。
blog/souba-外壁塗装-2026-07-04.html,149,相場入り/replace,外壁塗装の適正価格と資材市況を建設実務30年のプロがsouba-dbの実測データで解説します。適正相場の目安は50万〜80万円。見積書のチェックポイント、過剰請求の見分け方、業者に確認すべき点まで具体的にまとめました。相場より高い見積もりの特徴と、値引き交渉で使える根拠を実例つきで解説しています。
blog/souba-給湯器-2026-07-04.html,146,相場入り/replace,給湯器の適正価格と資材市況を建設実務30年のプロがsouba-dbの実測データで解説します。適正相場の目安は13万〜25万円。相場より高い見積もりの特徴と、値引き交渉で使える根拠を実例つきで解説しています。梅(最安)・竹(標準)・松(大手)の3プランで、あなたの見積もりが適正か比較できます。
check/index.html,123,定型/replace,悪徳業者チェッカーを建設実務30年のプロがsouba-dbの実測データで解説します。訪問販売の即決を断る方法や、相見積もりの取り方まであわせて確認できます。見積書のチェックポイント、過剰請求の見分け方、業者に確認すべき点まで具体的にまとめました。
ehn-en/index.html,156,定型/replace,EHN First Issue - Estimate Hacker Newsを建設実務30年のプロがsouba-dbの実測データで解説します。見積書のチェックポイント、過剰請求の見分け方、業者に確認すべき点まで具体的にまとめました。相場より高い見積もりの特徴と、値引き交渉で使える根拠を実例つきで解説しています。
ehn/amamori-mitsumori/index.html,153,定型/replace,雨漏り修理の見積もり、これって高い? 原因別の適正価格と全面やり直しの真偽を建設実務30年のプロがsouba-dbの実測データで解説します。相場より高い見積もりの特徴と、値引き交渉で使える根拠を実例つきで解説しています。梅(最安)・竹(標準)・松(大手)の3プランで、あなたの見積もりが適正か比較できます。
ehn/choshitsu-mitsumori/index.html,129,相場入り/replace,床下調湿剤の見積もり、その工事は本当に必要か。材料の値段と「補助」という正体を建設実務30年のプロがsouba-dbの実測データで解説します。適正相場の目安は1万〜3万円。梅(最安)・竹(標準)・松(大手)の3プランで、あなたの見積もりが適正か比較できます。
ehn/gaiheki-mitsumori/index.html,158,相場入り/replace,外壁塗装の見積もりしてもらったけど、これって高いの?を建設実務30年のプロがsouba-dbの実測データで解説します。適正相場の目安は80万〜110万円。訪問販売の即決を断る方法や、相見積もりの取り方まであわせて確認できます。見積書のチェックポイント、過剰請求の見分け方、業者に確認すべき点まで具体的にまとめました。
ehn/index.html,138,定型/replace,EHN 創刊号 ・ 見積もり達人ニュースを建設実務30年のプロがsouba-dbの実測データで解説します。見積書のチェックポイント、過剰請求の見分け方、業者に確認すべき点まで具体的にまとめました。相場より高い見積もりの特徴と、値引き交渉で使える根拠を実例つきで解説しています。
ehn/kyutoki-mitsumori/index.html,152,定型/replace,給湯器の交換見積もり、これって高い? ガス給湯器・号数別の適正価格を診断を建設実務30年のプロがsouba-dbの実測データで解説します。相場より高い見積もりの特徴と、値引き交渉で使える根拠を実例つきで解説しています。梅(最安)・竹(標準)・松(大手)の3プランで、あなたの見積もりが適正か比較できます。
ehn/reform-mitsumori/index.html,142,相場入り/replace,リフォーム見積もり・リノベーション工事見積もり、何社取っても安心できない本当の理由。無料一括の落とし穴を建設実務30年のプロがsouba-dbの実測データで解説します。適正相場の目安は1万〜8万円。梅(最安)・竹(標準)・松(大手)の3プランで、あなたの見積もりが適正か比較できます。
ehn/yane-mitsumori/index.html,155,相場入り/replace,屋根の修理の見積もり取ったけど、これって高いの?を建設実務30年のプロがsouba-dbの実測データで解説します。適正相場の目安は40万〜80万円。訪問販売の即決を断る方法や、相見積もりの取り方まであわせて確認できます。見積書のチェックポイント、過剰請求の見分け方、業者に確認すべき点まで具体的にまとめました。
estimate-biz/index.html,147,定型/replace,HORIZON ESTIMATE for Businessを建設実務30年のプロがsouba-dbの実測データで解説します。見積書のチェックポイント、過剰請求の見分け方、業者に確認すべき点まで具体的にまとめました。相場より高い見積もりの特徴と、値引き交渉で使える根拠を実例つきで解説しています。
guide/index.html,149,相場入り/replace,見積書は、読めなくて当たり前だ。を建設実務30年のプロがsouba-dbの実測データで解説します。適正相場の目安は15万〜25万円。相場より高い見積もりの特徴と、値引き交渉で使える根拠を実例つきで解説しています。梅(最安)・竹(標準)・松(大手)の3プランで、あなたの見積もりが適正か比較できます。
hacker/demand/index.html,128,定型/replace,需要ダッシュボード / 業者向けを建設実務30年のプロがsouba-dbの実測データで解説します。梅(最安)・竹(標準)・松(大手)の3プランで、あなたの見積もりが適正か比較できます。訪問販売の即決を断る方法や、相見積もりの取り方まであわせて確認できます。
hacker/index.html,135,定型/replace,見積もり達人 / 匿名見積もりデータベースを建設実務30年のプロがsouba-dbの実測データで解説します。訪問販売の即決を断る方法や、相見積もりの取り方まであわせて確認できます。見積書のチェックポイント、過剰請求の見分け方、業者に確認すべき点まで具体的にまとめました。
hacker/terms/index.html,137,定型/insert,投稿に関する利用規約 — 見積もり達人を建設実務30年のプロがsouba-dbの実測データで解説します。見積書のチェックポイント、過剰請求の見分け方、業者に確認すべき点まで具体的にまとめました。相場より高い見積もりの特徴と、値引き交渉で使える根拠を実例つきで解説しています。
hs-reverse-estimate/contract-report.html,124,定型/insert,工事完了レポートを建設実務30年のプロがsouba-dbの実測データで解説します。相場より高い見積もりの特徴と、値引き交渉で使える根拠を実例つきで解説しています。梅(最安)・竹(標準)・松(大手)の3プランで、あなたの見積もりが適正か比較できます。
index_en.html,159,定型/replace,A deterministic AI cost diagnostic system with SHA-256 audit hash and Bitcoin blockchain anchoring (Block #949356). Built by a 30-year construction veteran to.
jireishuu.html,151,相場入り/replace,リフォーム見積もり診断 実際の事例10選を建設実務30年のプロがsouba-dbの実測データで解説します。適正相場の目安は30万〜60万円。訪問販売の即決を断る方法や、相見積もりの取り方まであわせて確認できます。見積書のチェックポイント、過剰請求の見分け方、業者に確認すべき点まで具体的にまとめました。
jireishuu_en.html,156,定型/replace,"20 real construction cost diagnosis cases by HORIZON SHIELD — an AI tool built by a 30-year Japanese master carpenter. Maximum overcharge detected: $19,600."
kira_v4.html,123,定型/insert,KIRA v4を建設実務30年のプロがsouba-dbの実測データで解説します。相場より高い見積もりの特徴と、値引き交渉で使える根拠を実例つきで解説しています。梅(最安)・竹(標準)・松(大手)の3プランで、あなたの見積もりが適正か比較できます。
lp/index.html,122,定型/replace,見積もり達人 EHNを建設実務30年のプロがsouba-dbの実測データで解説します。梅(最安)・竹(標準)・松(大手)の3プランで、あなたの見積もりが適正か比較できます。訪問販売の即決を断る方法や、相見積もりの取り方まであわせて確認できます。
map.html,128,定型/replace,HORIZON SHIELDを建設実務30年のプロがsouba-dbの実測データで解説します。訪問販売の即決を断る方法や、相見積もりの取り方まであわせて確認できます。見積書のチェックポイント、過剰請求の見分け方、業者に確認すべき点まで具体的にまとめました。
