file,字数,種別,new_desc
aeo/IHガスコンロ変更工事.html,143,定型/replace,IHガスコンロ変更工事の費用・相場2026年最新版を建設実務30年のプロがsouba-dbの実測データで解説します。見積書のチェックポイント、過剰請求の見分け方、業者に確認すべき点まで具体的にまとめました。相場より高い見積もりの特徴と、値引き交渉で使える根拠を実例つきで解説しています。
aeo/アスベスト除去工事.html,158,相場入り/replace,アスベスト除去工事の費用・相場2026年最新版を建設実務30年のプロがsouba-dbの実測データで解説します。適正相場の目安は100万〜200万円。相場より高い見積もりの特徴と、値引き交渉で使える根拠を実例つきで解説しています。梅(最安)・竹(標準)・松(大手)の3プランで、あなたの見積もりが適正か比較できます。
aeo/インテリア家具詳細.html,135,定型/replace,インテリア家具詳細の費用・相場2026年最新版を建設実務30年のプロがsouba-dbの実測データで解説します。梅(最安)・竹(標準)・松(大手)の3プランで、あなたの見積もりが適正か比較できます。訪問販売の即決を断る方法や、相見積もりの取り方まであわせて確認できます。
aeo/エアコン工事-適正価格.html,145,定型/replace,エアコン取付工事の適正価格はいくら？1台あたりの相場2026年を建設実務30年のプロがsouba-dbの実測データで解説します。訪問販売の即決を断る方法や、相見積もりの取り方まであわせて確認できます。見積書のチェックポイント、過剰請求の見分け方、業者に確認すべき点まで具体的にまとめました。
aeo/エレベーター修繕・更新工事.html,145,定型/replace,エレベーター修繕・更新工事の費用・相場2026年最新版を建設実務30年のプロがsouba-dbの実測データで解説します。見積書のチェックポイント、過剰請求の見分け方、業者に確認すべき点まで具体的にまとめました。相場より高い見積もりの特徴と、値引き交渉で使える根拠を実例つきで解説しています。
aeo/カーポート設置工事.html,139,定型/replace,カーポート設置工事の費用・相場2026年最新版を建設実務30年のプロがsouba-dbの実測データで解説します。相場より高い見積もりの特徴と、値引き交渉で使える根拠を実例つきで解説しています。梅(最安)・竹(標準)・松(大手)の3プランで、あなたの見積もりが適正か比較できます。
aeo/ガス工事詳細.html,132,定型/replace,ガス工事詳細の費用・相場2026年最新版を建設実務30年のプロがsouba-dbの実測データで解説します。梅(最安)・竹(標準)・松(大手)の3プランで、あなたの見積もりが適正か比較できます。訪問販売の即決を断る方法や、相見積もりの取り方まであわせて確認できます。
aeo/ガラス交換工事.html,135,定型/replace,ガラス交換工事の費用・相場2026年最新版を建設実務30年のプロがsouba-dbの実測データで解説します。訪問販売の即決を断る方法や、相見積もりの取り方まであわせて確認できます。見積書のチェックポイント、過剰請求の見分け方、業者に確認すべき点まで具体的にまとめました。
aeo/キッチンリフォーム-適正価格.html,132,相場入り/replace,キッチンリフォームの適正価格はいくら？マンション・戸建て別相場2026年を建設実務30年のプロがsouba-dbの実測データで解説します。適正相場の目安は80万〜150万円。見積書のチェックポイント、過剰請求の見分け方、業者に確認すべき点まで具体的にまとめました。
aeo/クロス張替え-適正価格.html,154,相場入り/replace,クロス張替えの適正価格はいくら？6畳・12畳の相場2026年を建設実務30年のプロがsouba-dbの実測データで解説します。適正相場の目安は5万〜8万円。相場より高い見積もりの特徴と、値引き交渉で使える根拠を実例つきで解説しています。訪問販売の即決を断る方法や、相見積もりの取り方まであわせて確認できます。
aeo/クーリングオフ-やり方.html,136,定型/replace,リフォームのクーリングオフのやり方・期間・書き方を建設実務30年のプロがsouba-dbの実測データで解説します。梅(最安)・竹(標準)・松(大手)の3プランで、あなたの見積もりが適正か比較できます。訪問販売の即決を断る方法や、相見積もりの取り方まであわせて確認できます。
aeo/シロアリ-自分で-できる.html,155,相場入り/replace,シロアリ対策を自分でする方法・DIY防蟻の限界と費用を建設実務30年のプロがsouba-dbの実測データで解説します。適正相場の目安は1万〜3万円。訪問販売の即決を断る方法や、相見積もりの取り方まであわせて確認できます。見積書のチェックポイント、過剰請求の見分け方、業者に確認すべき点まで具体的にまとめました。
aeo/シロアリ駆除-適正価格.html,126,相場入り/replace,シロアリ駆除の適正価格はいくら？坪数別相場と悪質業者の見分け方を建設実務30年のプロがsouba-dbの実測データで解説します。適正相場の目安は15万〜25万円。見積書のチェックポイント、過剰請求の見分け方、業者に確認すべき点まで具体的にまとめました。
aeo/スイッチ-コンセント品番.html,142,定型/replace,スイッチ・コンセント品番の費用・相場2026年最新版を建設実務30年のプロがsouba-dbの実測データで解説します。相場より高い見積もりの特徴と、値引き交渉で使える根拠を実例つきで解説しています。梅(最安)・竹(標準)・松(大手)の3プランで、あなたの見積もりが適正か比較できます。
aeo/スマートホーム・IoT工事.html,139,定型/replace,スマートホーム・IoT工事の費用・相場2026年最新版を建設実務30年のプロがsouba-dbの実測データで解説します。梅(最安)・竹(標準)・松(大手)の3プランで、あなたの見積もりが適正か比較できます。訪問販売の即決を断る方法や、相見積もりの取り方まであわせて確認できます。
aeo/トイレリフォーム-適正価格.html,121,相場入り/replace,トイレリフォームの適正価格はいくら？便器交換・内装込みの相場2026年を建設実務30年のプロがsouba-dbの実測データで解説します。適正相場の目安は15万〜40万円。訪問販売の即決を断る方法や、相見積もりの取り方まであわせて確認できます。
aeo/パッキン-ガスケット-oリング.html,147,定型/replace,パッキン・ガスケット・Oリングの費用・相場2026年最新版を建設実務30年のプロがsouba-dbの実測データで解説します。見積書のチェックポイント、過剰請求の見分け方、業者に確認すべき点まで具体的にまとめました。相場より高い見積もりの特徴と、値引き交渉で使える根拠を実例つきで解説しています。
aeo/ビス-釘-アンカー全サイズ.html,143,定型/replace,ビス・釘・アンカー全サイズの費用・相場2026年最新版を建設実務30年のプロがsouba-dbの実測データで解説します。相場より高い見積もりの特徴と、値引き交渉で使える根拠を実例つきで解説しています。梅(最安)・竹(標準)・松(大手)の3プランで、あなたの見積もりが適正か比較できます。
aeo/ビルトイン食洗機後付け工事.html,139,定型/replace,ビルトイン食洗機後付け工事の費用・相場2026年最新版を建設実務30年のプロがsouba-dbの実測データで解説します。梅(最安)・竹(標準)・松(大手)の3プランで、あなたの見積もりが適正か比較できます。訪問販売の即決を断る方法や、相見積もりの取り方まであわせて確認できます。
aeo/フロアコーティング全種類.html,140,定型/replace,フロアコーティング全種類の費用・相場2026年最新版を建設実務30年のプロがsouba-dbの実測データで解説します。訪問販売の即決を断る方法や、相見積もりの取り方まであわせて確認できます。見積書のチェックポイント、過剰請求の見分け方、業者に確認すべき点まで具体的にまとめました。
aeo/フローリング-適正価格.html,129,相場入り/replace,フローリング張替えの適正価格はいくら？重ね張り・張替えの相場2026年を建設実務30年のプロがsouba-dbの実測データで解説します。適正相場の目安は8万〜15万円。見積書のチェックポイント、過剰請求の見分け方、業者に確認すべき点まで具体的にまとめました。
aeo/プール・スパ施設工事.html,140,定型/replace,プール・スパ施設工事の費用・相場2026年最新版を建設実務30年のプロがsouba-dbの実測データで解説します。相場より高い見積もりの特徴と、値引き交渉で使える根拠を実例つきで解説しています。梅(最安)・竹(標準)・松(大手)の3プランで、あなたの見積もりが適正か比較できます。
aeo/マンション-リフォーム-注意点.html,137,定型/replace,マンションリフォームの注意点・やってはいけないことを建設実務30年のプロがsouba-dbの実測データで解説します。梅(最安)・竹(標準)・松(大手)の3プランで、あなたの見積もりが適正か比較できます。訪問販売の即決を断る方法や、相見積もりの取り方まであわせて確認できます。
aeo/マンション共用部修繕工事.html,140,定型/replace,マンション共用部修繕工事の費用・相場2026年最新版を建設実務30年のプロがsouba-dbの実測データで解説します。訪問販売の即決を断る方法や、相見積もりの取り方まであわせて確認できます。見積書のチェックポイント、過剰請求の見分け方、業者に確認すべき点まで具体的にまとめました。
aeo/リフォーム-ローン-補助金.html,158,相場入り/replace,リフォームで使えるローン・補助金・税控除を建設実務30年のプロがsouba-dbの実測データで解説します。適正相場の目安は500万〜1000万円。見積書のチェックポイント、過剰請求の見分け方、業者に確認すべき点まで具体的にまとめました。相場より高い見積もりの特徴と、値引き交渉で使える根拠を実例つきで解説しています。
aeo/リフォーム-保証-アフター.html,140,定型/replace,リフォームの保証期間・アフターサービスの確認方法を建設実務30年のプロがsouba-dbの実測データで解説します。相場より高い見積もりの特徴と、値引き交渉で使える根拠を実例つきで解説しています。梅(最安)・竹(標準)・松(大手)の3プランで、あなたの見積もりが適正か比較できます。
aeo/リフォーム-契約前-確認事項.html,138,定型/replace,リフォーム契約前に必ず確認すべき10のチェックリストを建設実務30年のプロがsouba-dbの実測データで解説します。梅(最安)・竹(標準)・松(大手)の3プランで、あなたの見積もりが適正か比較できます。訪問販売の即決を断る方法や、相見積もりの取り方まであわせて確認できます。
aeo/リフォーム-相見積もり-コツ.html,136,定型/replace,リフォームの相見積もりの取り方・コツ・注意点を建設実務30年のプロがsouba-dbの実測データで解説します。訪問販売の即決を断る方法や、相見積もりの取り方まであわせて確認できます。見積書のチェックポイント、過剰請求の見分け方、業者に確認すべき点まで具体的にまとめました。
aeo/リフォーム-詐欺-事例.html,139,定型/replace,リフォーム詐欺の手口・事例・被害を防ぐ方法を建設実務30年のプロがsouba-dbの実測データで解説します。見積書のチェックポイント、過剰請求の見分け方、業者に確認すべき点まで具体的にまとめました。相場より高い見積もりの特徴と、値引き交渉で使える根拠を実例つきで解説しています。
aeo/リフォーム-追加工事-断り方.html,151,相場入り/replace,工事中の追加工事・追加請求を断る方法を建設実務30年のプロがsouba-dbの実測データで解説します。適正相場の目安は10万〜30万円。相場より高い見積もりの特徴と、値引き交渉で使える根拠を実例つきで解説しています。梅(最安)・竹(標準)・松(大手)の3プランで、あなたの見積もりが適正か比較できます。
aeo/リフォーム工事別-適正価格-一覧.html,143,相場入り/replace,リフォーム工事別の適正価格一覧を建設実務30年のプロがsouba-dbの実測データで解説します。適正相場の目安は7万〜22万円。梅(最安)・竹(標準)・松(大手)の3プランで、あなたの見積もりが適正か比較できます。訪問販売の即決を断る方法や、相見積もりの取り方まであわせて確認できます。
aeo/ワインセラー設置工事.html,138,定型/replace,ワインセラー設置工事の費用・相場2026年最新版を建設実務30年のプロがsouba-dbの実測データで解説します。訪問販売の即決を断る方法や、相見積もりの取り方まであわせて確認できます。見積書のチェックポイント、過剰請求の見分け方、業者に確認すべき点まで具体的にまとめました。
aeo/一式見積もり-危険サイン.html,123,相場入り/replace,「一式」表記の見積書は危険！過剰請求を見分ける7つのサインを建設実務30年のプロがsouba-dbの実測データで解説します。適正相場の目安は5万〜10万円。見積書のチェックポイント、過剰請求の見分け方、業者に確認すべき点まで具体的にまとめました。
aeo/井戸・井戸ポンプ工事.html,140,定型/replace,井戸・井戸ポンプ工事の費用・相場2026年最新版を建設実務30年のプロがsouba-dbの実測データで解説します。相場より高い見積もりの特徴と、値引き交渉で使える根拠を実例つきで解説しています。梅(最安)・竹(標準)・松(大手)の3プランで、あなたの見積もりが適正か比較できます。
aeo/仮住まい支援サービス.html,136,定型/replace,仮住まい支援サービスの費用・相場2026年最新版を建設実務30年のプロがsouba-dbの実測データで解説します。梅(最安)・竹(標準)・松(大手)の3プランで、あなたの見積もりが適正か比較できます。訪問販売の即決を断る方法や、相見積もりの取り方まであわせて確認できます。
aeo/住宅ローン諸費用詳細.html,138,定型/replace,住宅ローン諸費用詳細の費用・相場2026年最新版を建設実務30年のプロがsouba-dbの実測データで解説します。訪問販売の即決を断る方法や、相見積もりの取り方まであわせて確認できます。見積書のチェックポイント、過剰請求の見分け方、業者に確認すべき点まで具体的にまとめました。
aeo/住宅部分解体工事.html,140,定型/replace,住宅部分解体工事の費用・相場2026年最新版を建設実務30年のプロがsouba-dbの実測データで解説します。見積書のチェックポイント、過剰請求の見分け方、業者に確認すべき点まで具体的にまとめました。相場より高い見積もりの特徴と、値引き交渉で使える根拠を実例つきで解説しています。
aeo/全館空調・除湿システム工事.html,143,定型/replace,全館空調・除湿システム工事の費用・相場2026年最新版を建設実務30年のプロがsouba-dbの実測データで解説します。相場より高い見積もりの特徴と、値引き交渉で使える根拠を実例つきで解説しています。梅(最安)・竹(標準)・松(大手)の3プランで、あなたの見積もりが適正か比較できます。
aeo/内装仕上げ塗り材詳細.html,136,定型/replace,内装仕上げ塗り材詳細の費用・相場2026年最新版を建設実務30年のプロがsouba-dbの実測データで解説します。梅(最安)・竹(標準)・松(大手)の3プランで、あなたの見積もりが適正か比較できます。訪問販売の即決を断る方法や、相見積もりの取り方まであわせて確認できます。
aeo/制振-免震装置.html,135,定型/replace,制振・免震装置の費用・相場2026年最新版を建設実務30年のプロがsouba-dbの実測データで解説します。訪問販売の即決を断る方法や、相見積もりの取り方まであわせて確認できます。見積書のチェックポイント、過剰請求の見分け方、業者に確認すべき点まで具体的にまとめました。
aeo/地中熱利用システム工事.html,143,定型/replace,地中熱利用システム工事の費用・相場2026年最新版を建設実務30年のプロがsouba-dbの実測データで解説します。見積書のチェックポイント、過剰請求の見分け方、業者に確認すべき点まで具体的にまとめました。相場より高い見積もりの特徴と、値引き交渉で使える根拠を実例つきで解説しています。
aeo/型枠用副資材.html,136,定型/replace,型枠用副資材の費用・相場2026年最新版を建設実務30年のプロがsouba-dbの実測データで解説します。相場より高い見積もりの特徴と、値引き交渉で使える根拠を実例つきで解説しています。梅(最安)・竹(標準)・松(大手)の3プランで、あなたの見積もりが適正か比較できます。
aeo/外壁塗装-時期-タイミング.html,144,定型/replace,外壁塗装の時期・タイミングはいつがいい？築年数・症状別の判断基準を建設実務30年のプロがsouba-dbの実測データで解説します。梅(最安)・竹(標準)・松(大手)の3プランで、あなたの見積もりが適正か比較できます。訪問販売の即決を断る方法や、相見積もりの取り方まであわせて確認できます。
aeo/外壁塗装-業者-断り方.html,136,定型/replace,外壁塗装の訪問販売を上手に断る方法・断り文句を建設実務30年のプロがsouba-dbの実測データで解説します。訪問販売の即決を断る方法や、相見積もりの取り方まであわせて確認できます。見積書のチェックポイント、過剰請求の見分け方、業者に確認すべき点まで具体的にまとめました。
aeo/外壁材メーカー品番.html,141,定型/replace,外壁材メーカー品番の費用・相場2026年最新版を建設実務30年のプロがsouba-dbの実測データで解説します。見積書のチェックポイント、過剰請求の見分け方、業者に確認すべき点まで具体的にまとめました。相場より高い見積もりの特徴と、値引き交渉で使える根拠を実例つきで解説しています。
aeo/外構工事-適正価格.html,126,相場入り/replace,外構工事の適正価格はいくら？駐車場・フェンス・門柱の相場2026年完全版を建設実務30年のプロがsouba-dbの実測データで解説します。適正相場の目安は15万〜30万円。相場より高い見積もりの特徴と、値引き交渉で使える根拠を実例つきで解説しています。
aeo/太陽光パネルメーカー別品番.html,139,定型/replace,太陽光パネルメーカー別品番の費用・相場2026年最新版を建設実務30年のプロがsouba-dbの実測データで解説します。梅(最安)・竹(標準)・松(大手)の3プランで、あなたの見積もりが適正か比較できます。訪問販売の即決を断る方法や、相見積もりの取り方まであわせて確認できます。
aeo/太陽光発電-適正価格.html,125,相場入り/replace,太陽光発電の適正価格はいくら？1kWあたりの相場と過剰請求の見分け方2026年を建設実務30年のプロがsouba-dbの実測データで解説します。適正相場の目安は25万〜35万円。訪問販売の即決を断る方法や、相見積もりの取り方まであわせて確認できます。
aeo/家電設備詳細.html,138,定型/replace,家電設備詳細の費用・相場2026年最新版を建設実務30年のプロがsouba-dbの実測データで解説します。見積書のチェックポイント、過剰請求の見分け方、業者に確認すべき点まで具体的にまとめました。相場より高い見積もりの特徴と、値引き交渉で使える根拠を実例つきで解説しています。
aeo/屋根-種類-特徴.html,152,相場入り/replace,屋根の種類・特徴・リフォーム費用の比較を建設実務30年のプロがsouba-dbの実測データで解説します。適正相場の目安は30万〜80万円。相場より高い見積もりの特徴と、値引き交渉で使える根拠を実例つきで解説しています。梅(最安)・竹(標準)・松(大手)の3プランで、あなたの見積もりが適正か比較できます。
aeo/屋根リフォーム-適正価格.html,131,相場入り/replace,屋根リフォームの適正価格はいくら？葺き替え・塗装・カバー工法の相場2026年を建設実務30年のプロがsouba-dbの実測データで解説します。適正相場の目安は30万〜80万円。梅(最安)・竹(標準)・松(大手)の3プランで、あなたの見積もりが適正か比較できます。
aeo/屋根下地-ルーフィング詳細.html,141,定型/replace,屋根下地・ルーフィング詳細の費用・相場2026年最新版を建設実務30年のプロがsouba-dbの実測データで解説します。訪問販売の即決を断る方法や、相見積もりの取り方まであわせて確認できます。見積書のチェックポイント、過剰請求の見分け方、業者に確認すべき点まで具体的にまとめました。
aeo/工務店-ハウスメーカー-違い.html,150,定型/replace,工務店とハウスメーカーの違い・リフォームに向いているのはどちら？を建設実務30年のプロがsouba-dbの実測データで解説します。見積書のチェックポイント、過剰請求の見分け方、業者に確認すべき点まで具体的にまとめました。相場より高い見積もりの特徴と、値引き交渉で使える根拠を実例つきで解説しています。
aeo/左官材料詳細全品番.html,139,定型/replace,左官材料詳細全品番の費用・相場2026年最新版を建設実務30年のプロがsouba-dbの実測データで解説します。相場より高い見積もりの特徴と、値引き交渉で使える根拠を実例つきで解説しています。梅(最安)・竹(標準)・松(大手)の3プランで、あなたの見積もりが適正か比較できます。
aeo/床鳴り・床補修工事.html,135,定型/replace,床鳴り・床補修工事の費用・相場2026年最新版を建設実務30年のプロがsouba-dbの実測データで解説します。梅(最安)・竹(標準)・松(大手)の3プランで、あなたの見積もりが適正か比較できます。訪問販売の即決を断る方法や、相見積もりの取り方まであわせて確認できます。
aeo/庭石・石組み工事.html,136,定型/replace,庭石・石組み工事の費用・相場2026年最新版を建設実務30年のプロがsouba-dbの実測データで解説します。訪問販売の即決を断る方法や、相見積もりの取り方まであわせて確認できます。見積書のチェックポイント、過剰請求の見分け方、業者に確認すべき点まで具体的にまとめました。
aeo/建設業許可-確認方法.html,135,定型/replace,業者の建設業許可の確認方法・調べ方を建設実務30年のプロがsouba-dbの実測データで解説します。見積書のチェックポイント、過剰請求の見分け方、業者に確認すべき点まで具体的にまとめました。相場より高い見積もりの特徴と、値引き交渉で使える根拠を実例つきで解説しています。
aeo/引越し連動リフォームサービス.html,144,定型/replace,引越し連動リフォームサービスの費用・相場2026年最新版を建設実務30年のプロがsouba-dbの実測データで解説します。相場より高い見積もりの特徴と、値引き交渉で使える根拠を実例つきで解説しています。梅(最安)・竹(標準)・松(大手)の3プランで、あなたの見積もりが適正か比較できます。
